score,title,source_url,file,publish_date
7.44,Nvidia’s (NVDA) Data Center Boom Continues — Analyst Lifts Price Target to $192,https://finance.yahoo.com/news/nvidia-nvda-data-center-boom-150159157.html,filtered_01_score_7.4_2025-07-28-154236_nvidias-nvda-data-center-boom-continues-analyst-lifts-p.md,
7.38,"NVDA Stock Price Prediction: Where Nvidia Could Be by 2025, 2026, 2030",https://finance.yahoo.com/news/nvda-stock-price-prediction-where-070852948.html,filtered_02_score_7.4_2025-07-28-154252_nvda-stock-price-prediction-where-nvidia-could-be-by-2025.md,
7.20,Should You Buy Nvidia (NVDA) Stock Before Aug. 27? Here's What History Says.,https://finance.yahoo.com/news/buy-nvidia-nvda-stock-aug-103000384.html,filtered_03_score_7.2_2025-08-02-092103_should-you-buy-nvidia-nvda-stock-before-aug-27-here-s-wh.md,
7.18,Nvidia’s Stock Soars: A Comeback Story Amid Trade Tensions,https://www.tipranks.com/news/weekend-updates/nvidias-stock-soars-a-comeback-story-amid-trade-tensions,filtered_04_score_7.2_2025-07-28-154243_nvidias-stock-soars-a-comeback-story-amid-trade-tensions.md,
6.78,Where Will Nvidia Be in 5 Years?,https://www.fool.com/investing/2025/07/27/where-will-nvidia-be-in-5-years/,filtered_05_score_6.8_2025-07-28-154258_where-will-nvidia-be-in-5-years.md,2025-07-27 00:00:00
6.72,Can Nvidia Stock Skyrocket Another 370% By 2030? 1 Wall Street Analyst Says Yes.,https://www.fool.com/investing/2025/07/28/can-nvidia-stock-skyrocket-another-370-by-2030-1-w/,filtered_06_score_6.7_2025-07-28-154245_can-nvidia-stock-skyrocket-another-370-by-2030-1-wall-stre.md,2025-07-28 00:00:00
6.70,Nvidia Stock (NVDA) Trembles as Chinese Ramp Up Pressure on Chip Security Fears,https://www.tipranks.com/news/nvidia-stock-nvda-trembles-as-chinese-ramp-up-pressure-on-chip-security-fears,filtered_07_score_6.7_2025-08-02-092045_nvidia-stock-nvda-trembles-as-chinese-ramp-up-pressure-on.md,
6.59,Should You Forget Nvidia and Buy These 2 Millionaire-Maker Stocks Instead?,https://www.fool.com/investing/2025/07/31/should-you-forget-nvidia-and-buy-2-millionaire/,filtered_08_score_6.6_2025-08-02-092120_should-you-forget-nvidia-and-buy-these-2-millionaire-maker-s.md,2025-07-31 00:00:00
6.59,Alphabet CEO Sundar Pichai Just Delivered Incredible News for Nvidia Stock Investors,https://www.fool.com/investing/2025/08/01/alphabet-sundar-pichai-news-nvidia-stock-investors/,filtered_09_score_6.6_2025-08-02-092100_alphabet-ceo-sundar-pichai-just-delivered-incredible-news-fo.md,2025-08-01 00:00:00
6.48,Think It's Too Late to Buy Nvidia? Here's the Biggest Reason Why There's Still Time.,https://finance.yahoo.com/news/think-too-buy-nvidia-heres-131300710.html,filtered_10_score_6.5_2025-08-02-093321_think-it-s-too-late-to-buy-nvidia-here-s-the-biggest-reason.md,
